{
  "schema_version": "1.0.0",
  "module_id": "ABS.MODULE.ADAPTERS.PLATFORMS",
  "scope_id": "ABS.SCOPE.ABS_MODULE_ADAPTERS_PLATFORMS.EXAMPLE",
  "state": "UNTESTED",
  "requirement_evidence": [
    {
      "requirement_id": "ABS.REQ.PLATFORM_ADAPTERS.001",
      "evidence_ids": [
        "ABS.EVIDENCE.EXAMPLE.ABS_REQ_PLATFORM_ADAPTERS_001"
      ],
      "result": "NOT_RUN"
    },
    {
      "requirement_id": "ABS.REQ.PLATFORM_ADAPTERS.002",
      "evidence_ids": [
        "ABS.EVIDENCE.EXAMPLE.ABS_REQ_PLATFORM_ADAPTERS_002"
      ],
      "result": "NOT_RUN"
    },
    {
      "requirement_id": "ABS.REQ.PLATFORM_ADAPTERS.003",
      "evidence_ids": [
        "ABS.EVIDENCE.EXAMPLE.ABS_REQ_PLATFORM_ADAPTERS_003"
      ],
      "result": "NOT_RUN"
    }
  ],
  "candidate_hash": "sha256:0000000000000000000000000000000000000000000000000000000000000000",
  "limitations": [
    "Synthetic example; zero hash cannot support release."
  ],
  "updated_at": "2026-08-13T18:00:00Z"
}
